{
  "name": "demo-commercial-service",
  "description": "Proposed discovery card. Grants no authority.",
  "version": "0.3.1-proposal",
  "grants_authority": false,
  "supported_interfaces": [
    {
      "url": "https://example.invalid/api/v1/market",
      "protocol_binding": "HTTP+JSON",
      "protocol_version": "0"
    }
  ],
  "skills": [
    { "id": "bailment", "http_path": "/api/v1/market/bailments" },
    { "id": "x402", "http_path": "/x402/verify" }
  ],
  "exochain": {
    "service_did": "did:exo:demo-service",
    "signing_key_hex": "cdcdcdcdcdcdcdcdcdcdcdcdcdcdcdcdcdcdcdcdcdcdcdcdcdcdcdcdcdcdcdcd",
    "signature_hex": "abababababababababababababababababababababababababababababababababababababababababababababababababababababababababababababababab",
    "schema": "exo.market.discovery.card.v1"
  }
}
